{
  "$schema": "https://json-schema.org/draft/2020-12/schema",
  "$id": "https://roboboy.dev/schemas/panel-inventory-entry-v1.json",
  "title": "Robo-Boy Panel Inventory Entry",
  "type": "object",
  "additionalProperties": false,
  "required": [
    "schemaVersion",
    "id",
    "name",
    "description",
    "repository",
    "author",
    "latest"
  ],
  "properties": {
    "schemaVersion": { "const": 1 },
    "id": {
      "type": "string",
      "pattern": "^[a-z0-9]+(?:[._-][a-z0-9]+)*$",
      "maxLength": 128
    },
    "name": { "type": "string", "minLength": 1, "maxLength": 120 },
    "description": { "type": "string", "minLength": 1, "maxLength": 1000 },
    "repository": { "type": "string", "format": "uri", "pattern": "^https://" },
    "author": {
      "type": "object",
      "additionalProperties": false,
      "required": ["name"],
      "properties": {
        "name": { "type": "string", "minLength": 1, "maxLength": 120 },
        "url": { "type": "string", "format": "uri" }
      }
    },
    "latest": {
      "type": "object",
      "additionalProperties": false,
      "required": ["version", "compatibility", "capabilities", "distribution"],
      "properties": {
        "version": { "type": "string" },
        "compatibility": {
          "type": "object",
          "additionalProperties": false,
          "required": ["panelApi", "roboboy"],
          "properties": {
            "panelApi": { "type": "string", "minLength": 1 },
            "roboboy": { "type": "string", "minLength": 1 }
          }
        },
        "capabilities": {
          "type": "array",
          "uniqueItems": true,
          "items": {
            "enum": [
              "ros",
              "storage",
              "network",
              "web-bluetooth",
              "web-usb",
              "web-serial",
              "camera",
              "microphone",
              "webxr"
            ]
          }
        },
        "permissions": {
          "type": "object",
          "additionalProperties": false,
          "properties": {
            "ros": {
              "type": "object",
              "additionalProperties": false,
              "properties": {
                "discover": { "type": "boolean" },
                "selectTopic": { "type": "boolean" },
                "subscribe": { "$ref": "#/$defs/rosResources" },
                "publish": { "$ref": "#/$defs/rosResources" },
                "services": { "$ref": "#/$defs/rosResources" }
              }
            },
            "network": {
              "type": "object",
              "additionalProperties": false,
              "properties": {
                "origins": {
                  "type": "array",
                  "maxItems": 30,
                  "uniqueItems": true,
                  "items": { "type": "string", "minLength": 1, "maxLength": 2048 }
                },
                "hostEndpoints": {
                  "type": "array",
                  "maxItems": 4,
                  "uniqueItems": true,
                  "items": {
                    "enum": [
                      "videoStream",
                      "webrtcWhep",
                      "webrtcDiscovery",
                      "webrtcHls"
                    ]
                  }
                }
              }
            }
          }
        },
        "distribution": {
          "type": "object",
          "additionalProperties": false,
          "required": [
            "type",
            "manifestUrl",
            "bundleUrl",
            "entryPoint",
            "integrity"
          ],
          "properties": {
            "type": { "const": "javascript-bundle" },
            "manifestUrl": {
              "type": "string",
              "format": "uri",
              "pattern": "^https://"
            },
            "bundleUrl": {
              "type": "string",
              "format": "uri",
              "pattern": "^https://"
            },
            "entryPoint": { "type": "string", "minLength": 1 },
            "integrity": {
              "type": "string",
              "pattern": "^sha256-[A-Za-z0-9+/]{43}=$"
            }
          }
        }
      },
      "allOf": [
        {
          "if": { "properties": { "capabilities": { "contains": { "const": "ros" } } } },
          "then": {
            "required": ["permissions"],
            "properties": { "permissions": { "required": ["ros"] } }
          }
        },
        {
          "if": { "properties": { "capabilities": { "contains": { "const": "network" } } } },
          "then": {
            "required": ["permissions"],
            "properties": { "permissions": { "required": ["network"] } }
          }
        }
      ]
    },
    "tags": {
      "type": "array",
      "uniqueItems": true,
      "items": { "type": "string", "minLength": 1, "maxLength": 80 }
    },
    "icon": { "type": "string", "format": "uri" },
    "preview": { "type": "string", "format": "uri" }
  },
  "$defs": {
    "rosResources": {
      "type": "array",
      "maxItems": 100,
      "uniqueItems": true,
      "items": {
        "type": "string",
        "pattern": "^/[A-Za-z0-9_~{}*][A-Za-z0-9_~{}/*-]*$"
      }
    }
  }
}
