{
  "schemaVersion": 1,
  "id": "la.tessel.roboboy.webrtc",
  "name": "WebRTC / RTSP Camera",
  "description": "Plays low-latency WHEP streams and documents their RTSP gateway source.",
  "repository": "https://github.com/tessel-la/roboboy-webrtc-panel",
  "author": {
    "name": "Tessella"
  },
  "latest": {
    "version": "3.0.1",
    "compatibility": {
      "panelApi": "^2.0.0",
      "roboboy": ">=0.7.0-alpha <1.0.0"
    },
    "capabilities": ["network", "storage"],
    "permissions": {
      "network": {
        "hostEndpoints": ["webrtcWhep", "webrtcDiscovery", "webrtcHls"]
      }
    },
    "distribution": {
      "type": "javascript-bundle",
      "manifestUrl": "https://github.com/tessel-la/roboboy-webrtc-panel/releases/download/v3.0.1/roboboy.panel.json",
      "bundleUrl": "https://github.com/tessel-la/roboboy-webrtc-panel/releases/download/v3.0.1/index.js",
      "entryPoint": "index.js",
      "integrity": "sha256-d9dZyyEqh5NUfIgMsD/Sn8tTfNKjzsI1R1rLD4ZQ8Og="
    }
  },
  "tags": ["camera", "webrtc", "whep", "rtsp", "video"]
}
