{
  "schemaVersion": 1,
  "id": "la.tessel.roboboy.timeseries",
  "name": "ROS Time Series",
  "description": "Plots multiple ROS telemetry series with real-time smoothing, bounded history, and compact controls.",
  "repository": "https://github.com/tessel-la/roboboy-timeseries-panel",
  "author": {
    "name": "Tessella"
  },
  "latest": {
    "version": "2.1.0",
    "compatibility": {
      "panelApi": "^2.0.0",
      "roboboy": ">=0.3.0-0 <1.0.0"
    },
    "capabilities": ["ros", "storage"],
    "permissions": {
      "ros": {
        "selectTopic": true
      }
    },
    "distribution": {
      "type": "javascript-bundle",
      "manifestUrl": "https://github.com/tessel-la/roboboy-timeseries-panel/releases/download/v2.1.0/roboboy.panel.json",
      "bundleUrl": "https://github.com/tessel-la/roboboy-timeseries-panel/releases/download/v2.1.0/index.js",
      "entryPoint": "index.js",
      "integrity": "sha256-X/GzKO86ogV9+pSktdslhYqqekj4A9DI/5eWgt/Ioyc="
    }
  },
  "tags": ["ros", "telemetry", "plot", "timeseries"]
}
