{
  "schemaVersion": 1,
  "id": "la.tessel.roboboy.hello",
  "name": "Hello Panel",
  "description": "A minimal external panel that demonstrates the Robo-Boy panel lifecycle.",
  "repository": "https://github.com/tessel-la/robo-boy-hello-panel",
  "author": {
    "name": "Tessella"
  },
  "latest": {
    "version": "2.0.0",
    "compatibility": {
      "panelApi": "^2.0.0",
      "roboboy": ">=0.3.0-0 <1.0.0"
    },
    "capabilities": ["storage"],
    "distribution": {
      "type": "javascript-bundle",
      "manifestUrl": "https://github.com/tessel-la/robo-boy-hello-panel/releases/download/v2.0.0/roboboy.panel.json",
      "bundleUrl": "https://github.com/tessel-la/robo-boy-hello-panel/releases/download/v2.0.0/index.js",
      "entryPoint": "index.js",
      "integrity": "sha256-g9HqGT5s5tI+xSqy8jNHcmY17Rz2GPoorSXW/E8ZN34="
    }
  },
  "tags": ["example", "developer-tools"]
}
